{
  "schema_version": 1,
  "manifest_id": "mpd-v1-month-token-vectors-1-manifest",
  "fixture_type": "mpd_v1_vector_set",
  "fixture_id": "mpd-v1-month-token-vectors-1",
  "artifact": {
    "path": "fixtures/stage-0/mpd/month-token-vectors.json",
    "media_type": "application/json",
    "encoding": "UTF-8",
    "line_endings": "LF",
    "final_newline": true,
    "byte_length": 21953,
    "sha256": "2d5f0f2dbae2741bed8ed477d80d811e0fc300d0f76d504a06bd7d7c97b8961f"
  },
  "payload_schema": {
    "path": "fixtures/stage-0/mpd/month-token-vectors.schema.json",
    "dialect": "https://json-schema.org/draft/2020-12/schema",
    "strict_mode": true,
    "byte_length": 29261,
    "sha256": "2dd6f97452fb6a811f598636040efb9943b1fbfe5fed24f228d27724be637ad7"
  },
  "provenance": {
    "source": "project_generated_public_synthetic",
    "construction_method_id": "mpd-v1-hkdf-hmac-known-answer-vectors",
    "construction_method_version": 1,
    "redistribution_basis": "project_authored_public_test_data",
    "generated_from_live_or_restricted_data": false
  },
  "determinism": {
    "randomness_used": false,
    "network_independent": true,
    "clock_independent": true,
    "locale_independent": true,
    "timezone_independent": true,
    "architecture_independent": true,
    "machine_state_independent": true
  },
  "case_counts": {
    "derivation": 3,
    "server_digest": 2,
    "utc_month": 4,
    "binary_length": 4,
    "derivation_mutation": 4,
    "month_validation": 6,
    "token_validation": 6,
    "digest_input": 1,
    "request_month": 5,
    "withdrawal": 8,
    "total": 43
  },
  "safety": {
    "classification": "public_synthetic",
    "contains_protocol_shaped_public_test_values": true,
    "contains_captured_or_operational_material": false,
    "contains_real_identifier": false,
    "contains_production_secret_or_pepper": false,
    "historical_months_only": true,
    "operational_use_forbidden": true,
    "offline_only": true
  },
  "validations": {
    "manifest_schema_strict_compile": true,
    "payload_schema_strict_compile": true,
    "payload_schema_validation": true,
    "case_counts_verified": true,
    "case_ids_unique": true,
    "references_resolved": true,
    "cryptography_recomputed": true,
    "independent_crypto_implementations": [
      "node_standard_crypto",
      "python_standard_library",
      "openssl_cli"
    ],
    "canonical_base64url_verified": true,
    "utc_semantics_verified": true,
    "artifact_digest_and_size_verified": true,
    "public_safety_review": "independent_review_complete"
  },
  "scope": {
    "runnable_harness_included": false,
    "application_code_included": false,
    "production_dependency_selected": false,
    "proof_pass_claimed": false,
    "consent_or_public_wording_approved": false,
    "retention_or_finalization_policy_approved": false
  }
}
